{
    "apiVersion": "aipg.intel.com/v1",
    "kind": "StreamPrediction",
    "metadata": {
        "name": "stream-12"
    },
    "spec": {
        "securitySpec": {
            "presignedToken": "foobar",
            "jwtToken": "barbaz"
        },
        "neonRepoSpec": {
            "repoURL": "http://github.com/bar/baz",
            "commit": "7874ba0e2d4744a20d8904b0e5bdc2dacfb0fc8c"
        },
        "kryptonRepoSpec": {
            "image": "ubuntu",
            "sidecarImage": "ubuntu",
            "repoURL": "http://github.com/bar/foo",
            "commit": "0f7aab7a458521a1d7b82462c2751ed3e22bfd99"
        },
        "streamDataSpec": {
            "modelPRM": "",
            "modelPath": "asdfaf",
            "datasetPath": "",
            "extraFilename": "",
            "customCodeURL": "",
            "customCommit": "",
            "awsPath": "",
            "aWSDefaultRegion": "",
            "streamID": 1,
            "streamName": ""
        },
        "state": "Running"

    },
    "status": {
        "state": "Pending"
    }
}
